{
  "source_url": "https://www.nikko-pc.com/site/",
  "printer_id": "nikko-kikaku",
  "content_hash": "sha256:f253e13d64056e8d5b322bdc9e871812448f350624f5cadde17462794d76c4f2",
  "content_chars": 1877,
  "extractor": "manual",
  "extracted_at": "2026-10-07T10:50:00+09:00",
  "result": "no_fair",
  "fairs": [],
  "issues": [
    "not_fair"
  ],
  "master_candidates": [],
  "note": "トップページ（ピックアップイベントの締切一覧）。イベント日から探す機能の情報源候補。"
}
