{
  "source_url": "https://www.pico-net.com/doujinshi/service/post_15.html",
  "printer_id": "pico",
  "content_hash": "sha256:b57ce4aefe4b3a3793c65eff39929128670d7190f9aae632223911b22db3f0af",
  "content_chars": 9895,
  "extractor": "manual",
  "extracted_at": "2026-10-21T01:30:00+09:00",
  "result": "no_fair",
  "fairs": [],
  "issues": [
    "not_fair"
  ],
  "master_candidates": [],
  "note": "セピアセット（新登場）の通常の商品ページ。期間・特典の記載なし。"
}
