{
  "source_url": "https://www.eikou.com/campaign/",
  "printer_id": "eikou",
  "content_hash": "sha256:73ae5c3302920cdf12d943448d65aac643c7566a62e6d3253176efc89800718c",
  "content_chars": 5155,
  "extractor": "manual",
  "extracted_at": "2026-10-15T15:18:07+09:00",
  "result": "fairs",
  "fairs": [
    {
      "fair_id": "eikou-offset-30-2026",
      "fair_name": "“オフセット印刷に栄光あれ!!” オフセット限定30%割引キャンペーン",
      "sources": [
        "https://www.eikou.com/campaign/"
      ],
      "summary": "オフセットコースの商品が30%割引になる。10月30日締切までの入稿が対象。",
      "benefit_summary": "オフセットコース30%OFF",
      "source_type": "official_campaign",
      "usable_from": "2026-10-16",
      "usable_from_text": "10月16日（締切の2週間前から選択可能）",
      "usable_from_precision": "day",
      "usable_until": "2026-10-30",
      "usable_until_text": "10月30日(金)締切",
      "usable_until_precision": "day",
      "end_date": "2026-10-30",
      "end_date_text": "10月30日(金)締切",
      "end_date_precision": "day",
      "deadline_note": "11月20日出荷、11/22のイベント合わせから。",
      "specific_sets_only": true,
      "application_required": true,
      "combinable": false,
      "conditions_text": "オフセットコースの商品が対象。 申告制（注文フォームのキャンペーン欄で選択）・他のキャンペーンや特典と併用不可。割引はセット料金のみ（オプションは対象外）。バリュープライス・特急商品は対象外。締切は17:00。",
      "printing_methods": [
        "offset"
      ],
      "benefit_types": [
        "discount"
      ],
      "discount_rate": 30,
      "tags": [
        "limited_time"
      ]
    },
    {
      "fair_id": "eikou-offset-cover-2color-2026",
      "fair_name": "“オフセット印刷に栄光あれ!!” 表紙2色刷りオプション無料キャンペーン",
      "sources": [
        "https://www.eikou.com/campaign/"
      ],
      "summary": "オフセットコースのモノトーンセットなどで、表紙2色刷りオプションの料金が無料になる。",
      "benefit_summary": "表紙2色刷りオプション無料",
      "source_type": "official_campaign",
      "usable_from": "2026-11-01",
      "usable_from_text": "11月1日",
      "usable_from_precision": "day",
      "usable_until": "2026-11-30",
      "usable_until_text": "11月30日17:00締切",
      "usable_until_precision": "day",
      "end_date": "2026-11-30",
      "end_date_text": "11月30日17:00締切",
      "end_date_precision": "day",
      "specific_sets_only": true,
      "application_required": true,
      "combinable": false,
      "conditions_text": "オフセットコースのモノトーンセット・特殊紙モノトーンセット・ノベルセットが対象。締切の1週間前から選択可能。 申告制（注文フォームのキャンペーン欄で選択）・他のキャンペーンや特典と併用不可。バリュープライス・特急商品は対象外。締切は17:00。",
      "printing_methods": [
        "offset"
      ],
      "benefit_types": [
        "free_option"
      ],
      "free_options": [
        "表紙2色刷りオプション"
      ],
      "tags": [
        "limited_time"
      ]
    },
    {
      "fair_id": "eikou-thanks-day-2026-11",
      "fair_name": "恒例“同人誌感謝の日30%割引”",
      "sources": [
        "https://www.eikou.com/campaign/"
      ],
      "summary": "毎年3/30・6/30・11/30に実施する感謝の日。11月30日締切までに入稿すると、同人誌セットが30%割引になる。",
      "benefit_summary": "同人誌セット30%OFF",
      "source_type": "official_campaign",
      "usable_from": "2026-11-23",
      "usable_from_text": "11月23日（締切の1週間前から選択可能）",
      "usable_from_precision": "day",
      "usable_until": "2026-11-30",
      "usable_until_text": "11月30日(月)締切",
      "usable_until_precision": "day",
      "end_date": "2026-11-30",
      "end_date_text": "11月30日(月)締切",
      "end_date_precision": "day",
      "deadline_note": "12月18日出荷、12/20のイベント合わせから（冬イベント向け）。毎年3/30・6/30・11/30に実施。",
      "specific_sets_only": true,
      "application_required": true,
      "combinable": false,
      "conditions_text": "VALUE・ぷちっとセットは対象外。ノベルセット・オールカラー・6色表紙セットは例外的に15%割引（注文時は「同人誌感謝の日バリュープライス15%割引」を選択）。 申告制（注文フォームのキャンペーン欄で選択）・他のキャンペーンや特典と併用不可。割引はセット料金のみ（オプションは対象外）。特急商品は対象外。締切は17:00。",
      "benefit_types": [
        "discount"
      ],
      "discount_rate": 30,
      "tags": [
        "limited_time"
      ]
    },
    {
      "fair_id": "eikou-okite-yaburi-2026-1207",
      "fair_name": "同人誌セット“掟破りの25%割引”（12/7締切）",
      "sources": [
        "https://www.eikou.com/campaign/"
      ],
      "summary": "冬恒例の割引。12月7日締切までに入稿すると、同人誌セットの価格が25%割引になる（12/21締切の回もある）。",
      "benefit_summary": "同人誌セット25%OFF",
      "source_type": "official_campaign",
      "usable_from": "2026-11-30",
      "usable_from_text": "11月30日（締切の1週間前から選択可能）",
      "usable_from_precision": "day",
      "usable_until": "2026-12-07",
      "usable_until_text": "12月7日(月)締切",
      "usable_until_precision": "day",
      "end_date": "2026-12-07",
      "end_date_text": "12月7日(月)締切",
      "end_date_precision": "day",
      "deadline_note": "12月27日出荷、12/29のイベント合わせから。",
      "specific_sets_only": true,
      "application_required": true,
      "combinable": false,
      "conditions_text": "VALUE・モノトーンブックレット・ぷちっとセットは対象外。ノベルセット・オールカラー・6色セットは例外的に10%割引（注文時は「掟破りの10%割引」を選択）。 申告制（注文フォームのキャンペーン欄で選択）・他のキャンペーンや特典と併用不可。割引はセット料金のみ（オプションは対象外）。特急商品は対象外。締切は17:00。",
      "benefit_types": [
        "discount"
      ],
      "discount_rate": 25,
      "tags": [
        "limited_time",
        "seasonal"
      ]
    },
    {
      "fair_id": "eikou-okite-yaburi-2026-1221",
      "fair_name": "同人誌セット“掟破りの25%割引”（12/21締切）",
      "sources": [
        "https://www.eikou.com/campaign/"
      ],
      "summary": "冬恒例の割引。12月21日締切までに入稿すると、同人誌セットの価格が25%割引になる（12/7締切の回もある）。",
      "benefit_summary": "同人誌セット25%OFF",
      "source_type": "official_campaign",
      "usable_from": "2026-12-14",
      "usable_from_text": "12月14日（締切の1週間前から選択可能）",
      "usable_from_precision": "day",
      "usable_until": "2026-12-21",
      "usable_until_text": "12月21日(月)締切",
      "usable_until_precision": "day",
      "end_date": "2026-12-21",
      "end_date_text": "12月21日(月)締切",
      "end_date_precision": "day",
      "deadline_note": "2027年1月8日出荷、1/10のイベント合わせから。",
      "specific_sets_only": true,
      "application_required": true,
      "combinable": false,
      "conditions_text": "VALUE・モノトーンブックレット・ぷちっとセットは対象外。ノベルセット・オールカラー・6色セットは例外的に10%割引（注文時は「掟破りの10%割引」を選択）。 申告制（注文フォームのキャンペーン欄で選択）・他のキャンペーンや特典と併用不可。割引はセット料金のみ（オプションは対象外）。特急商品は対象外。締切は17:00。",
      "benefit_types": [
        "discount"
      ],
      "discount_rate": 25,
      "tags": [
        "limited_time",
        "seasonal"
      ]
    },
    {
      "fair_id": "eikou-early-submission-discount",
      "fair_name": "早期入稿割引キャンペーン",
      "sources": [
        "https://www.eikou.com/campaign/"
      ],
      "summary": "イベントごとの「早期入稿割引締切日」までに入稿すると、ベーシックセットなどが20%、特殊紙セットなどが10%割引になる。イベントに参加しなくても使える。",
      "benefit_summary": "早期入稿でセットが20%・10%OFF",
      "source_type": "official_campaign",
      "timing_type": "recurring",
      "submission_dates_text": "通年。イベントごとに「早期入稿割引締切日」がある（締切情報ページで確認）",
      "processes": [
        "foil",
        "special_paper"
      ],
      "benefit_types": [
        "discount"
      ],
      "specific_sets_only": true,
      "application_required": true,
      "combinable": false,
      "conditions_text": "20%OFF：ベーシックセット・巻頭カラーセット・箔押しセット・モノトーンセット。10%OFF：特殊紙モノトーンセット・特殊紙カラーセット・ホワイトセット。注文フォームの「キャンペーン/Glory特典」欄で「早期入稿割引」を選択。発送日は選んだ割引の左に書かれた日に統一（早く入稿しても早まらない）。作業日が加算されるオプションと併用するときは締切が前倒し。他のキャンペーン・割引・特典と併用不可。オプション料金は対象外。",
      "image_checked_items": [
        "対象セット",
        "割引率"
      ],
      "image_checked_at": "2026-10-07",
      "image_recheck": false
    }
  ],
  "issues": [
    "multiple_fairs",
    "year_inferred",
    "image_only"
  ],
  "master_candidates": [],
  "note": "10/15再確認：登録6件の期間・締切は一致し変更なし。ハロウィン25%（10/12終了）は一覧から消えた。グッズのみ3件（同レボ!バキッと・カレンダー15%OFF・栄光セレクト!グッズ15%OFF）とイベント主催者向け特典は対象外。年は曜日から2026年。早期入稿割引の対象セット・割引率は画像（10/7確認）。"
}
