{
  "source_url": "https://www.shimaya.net/fair/4season/",
  "printer_id": "shimaya",
  "content_hash": "sha256:6f7a5a275145218ce67b953b3725a0263ca60cdb1a4ae1fe1f654e3e5e5549a2",
  "content_chars": 1428,
  "extractor": "manual",
  "extracted_at": "2026-10-08T22:18:00+09:00",
  "result": "no_fair",
  "fairs": [],
  "issues": [
    "not_fair"
  ],
  "master_candidates": [],
  "note": "4シーズンフェアの一覧ページ。各季節の企画は個別ページで確認する。"
}
