{
  "source_url": "https://www.kanazawa-p.co.jp/fea/index.html",
  "printer_id": "kanazawa-insatsu",
  "content_hash": "sha256:d4eb208247f2e32d8688cc106851e80db0eaa04fcb31a74e0a3f8683d685b752",
  "content_chars": 11738,
  "extractor": "manual",
  "extracted_at": "2026-10-20T09:42:18+00:00",
  "result": "fairs",
  "fairs": [
    {
      "fair_id": "kanazawa-insatsu-early-discount",
      "fair_name": "早割（イベント合わせ）",
      "sources": [
        "https://www.kanazawa-p.co.jp/fea/index.html",
        "https://www.kanazawa-p.co.jp/early30/index.html"
      ],
      "summary": "イベントへの搬入に合わせて早めに入稿すると、前金セット商品が最大30%OFFになる。入稿日が早いほど割引率が高く、イベントごとに日程が組まれている。",
      "benefit_summary": "早く入稿するほど最大30%OFF",
      "source_type": "official_fair",
      "timing_type": "recurring",
      "submission_dates_text": "イベントごとに、早く入稿するほど割引率が上がる（30%・25%・20%・15%・10%）",
      "printing_methods": [
        "offset",
        "ondemand"
      ],
      "benefit_types": [
        "discount"
      ],
      "specific_sets_only": true,
      "combinable": false,
      "application_required": true,
      "conditions_text": "前金セット商品が対象（早割30・25・20はスタンダードオフセットなど7〜8種、早割15は6種、早割10は表オフ本オンデセット・オンデセットの2種）。他のフェアと併用不可。締切は宅配便・郵便が必着、オンライン入稿が15時まで。発送日はイベント合わせで、納品日の指定・早期納品は不可（早めに自宅で受け取りたい場合や宅配搬入の場合は、前週のフェアを使うよう案内あり）。早割15・10はアナログ原稿の対象外。申し込み時に早割の指定が必要（オンライン入稿は見積りで「利用する」にチェック、郵送は注文書の備考欄に記入）。"
    }
  ],
  "issues": [],
  "master_candidates": [],
  "note": "Run 3（2026-10-20）：早割の日程表が新しいイベント（10/25〜11/29合わせ）に更新されただけで、仕組み（30・25・20・15・10%、前金セット、併用不可、アナログ原稿の扱い）は登録内容と同じ。定期開催のため回ごとに分けない（抽出ルール4-2-2）。"
}
