{
  "source_url": "https://www.pico-net.com/doujinshi/117.html",
  "printer_id": "pico",
  "content_hash": "sha256:830fce6a1fb73b9fe4b42ddaaa8ff125d8ca5b2ae56394ed94120b63c1e0edc7",
  "content_chars": 4340,
  "extractor": "manual",
  "extracted_at": "2026-10-21T01:30:00+09:00",
  "result": "no_fair",
  "fairs": [],
  "issues": [
    "not_fair",
    "image_only"
  ],
  "master_candidates": [],
  "note": "ツクヨミ物語（11/7）の〆切表。支援中イベントの一覧に無く、締切案内のため対象外（本文は画像のみ）。"
}
